COUNCIL	Casey City Council 2024
WARD (if applicable)	Waratah Ward
CANDIDATE’S NAME (as on ballot paper)	SINGH, Jamel Kaur
"What is your vision for the municipality of the above Council? (maximum 50 words)
My vision for Casey is a community where everyone feels safe, supported, and valued. I want
to see our neighborhoods become vibrant and inclusive, with access to services addressing
issues like crime, healthcare, and housing. Where local voices are heard, streets maintained,
and every resident has the opportunity to thrive."
"What expertise or attributes do you have which would help you in undertaking the role of Councillor?
Provide details (maximum 50 words)
With grassroots community engagement, a Bachelor of Business, and an MBA, I bring a
strong skillset and experience. I've served on boards across finance, business, not-for-profits,
community sports, interfaith, and schools, providing me with hands-on expertise and
motivation to effectively serve as your councillor."
Have you read the current Council Plan for the council named above?	Yes	
Have you read the current Councillor Code of Conduct for the council named above?	Yes	
"Are you endorsed by a registered political party?
Note: Registered political party has the same meaning as in Part 4 of the Electoral Act 2002.
If yes, provide the name of the registered political party."	No	
Are you currently a Councillor?	No	
""		
"If yes, what has been your attendance record at Council meetings during your
current term of office?
Note: Council meetings means Council meetings referred to in section 61 of the Local Government Act 2020 but
does not include meetings held for which a Councillor has been granted leave from attending by the Council."		
"What are your contact details (so that voters can contact you)? Provide details
Jamel Kaur Singh. Please feel free to connect with me about any queries or concerns.
Facebook: Jamel Kaur Singh Jamel@Outlook.com.au PO Box 77, Doveton, 3177"		
