COUNCIL	Casey City Council 2024
WARD (if applicable)	River Gum Ward
CANDIDATE’S NAME (as on ballot paper)	YOUSAFI, Nazir
"What is your vision for the municipality of the above Council? (maximum 50 words)
My vision for the area is improving community services, more programs for youth, enhancing
local infrastructure, and ensuring sustainable development. I will focus on increasing public
safety, supporting local businesses, and creating more recreational spaces. My goal is to
build a vibrant, inclusive, and thriving community."
"What expertise or attributes do you have which would help you in undertaking the role of Councillor?
Provide details (maximum 50 words)
With 12 years of experience as a case manager in community services, I understand the
challenges our families and youth face. My involvement as a board member in local
government and not-for-profit organizations has equipped me with the skills and insight
needed to effectively serve as a dedicated councilor."
Have you read the current Council Plan for the council named above?	Yes	
Have you read the current Councillor Code of Conduct for the council named above?	Yes	
"Are you endorsed by a registered political party?
Note: Registered political party has the same meaning as in Part 4 of the Electoral Act 2002.
If yes, provide the name of the registered political party."	No	
Are you currently a Councillor?	No	
""		
"If yes, what has been your attendance record at Council meetings during your
current term of office?
Note: Council meetings means Council meetings referred to in section 61 of the Local Government Act 2020 but
does not include meetings held for which a Councillor has been granted leave from attending by the Council."		
"What are your contact details (so that voters can contact you)? Provide details
M: 0435 803 774 E: nazir.yousafi@gmail.com"		
