COUNCIL	Casey City Council 2024
WARD (if applicable)	Casuarina Ward
CANDIDATE’S NAME (as on ballot paper)	ROSS, Kim
"What is your vision for the municipality of the above Council? (maximum 50 words)
My vision for Casey is to embrace our diversity and create a welcoming and beautifully green
city. I want to ensure Casey is a sustainable, positive place to live; and that youth are
engaged and hopeful. Increased priority on accessibility and thriving green spaces will
connect residents and support well-being."
"What expertise or attributes do you have which would help you in undertaking the role of Councillor?
Provide details (maximum 50 words)
I value openness, curiosity and wisdom. As a psychologist, I have a positive and practical
approach to problems and a solution-focused attitude. I listen well, ask insightful questions
and consider different perspectives when making decisions. Collaboration and connection are
priorities and will help me strongly advocate for your needs."
Have you read the current Council Plan for the council named above?	Yes	
Have you read the current Councillor Code of Conduct for the council named above?	Yes	
"Are you endorsed by a registered political party?
Note: Registered political party has the same meaning as in Part 4 of the Electoral Act 2002.
If yes, provide the name of the registered political party."	No	
Are you currently a Councillor?	No	
""		
"If yes, what has been your attendance record at Council meetings during your
current term of office?
Note: Council meetings means Council meetings referred to in section 61 of the Local Government Act 2020 but
does not include meetings held for which a Councillor has been granted leave from attending by the Council."		
"What are your contact details (so that voters can contact you)? Provide details
I can be reached at kimrossyouthfirst@gmail.com, via facebook/messenger at
https://bit.ly/KimForCasey or on 0494165171."		
