COUNCIL	Casey City Council 2024
WARD (if applicable)	Tooradin Ward
CANDIDATE’S NAME (as on ballot paper)	YAGHOBI, Ali
"What is your vision for the municipality of the above Council? (maximum 50 words)
My vision for Casey is to become the most liveable City in Australia where every resident
feels that they belong and can thrive in this community, and to ensure services and programs
are accessible to everyone and most of the jobs for our community members are created in
our city."
"What expertise or attributes do you have which would help you in undertaking the role of Councillor?
Provide details (maximum 50 words)
My personal values are service, integrity, hard work and being fair. I have worked in
employment; aged care services and disability. As well, I currently work with a Council. I am
confident that I can bring my personal values and experiences to serve our community as
your new Councillor."
Have you read the current Council Plan for the council named above?	Yes	
Have you read the current Councillor Code of Conduct for the council named above?	Yes	
"Are you endorsed by a registered political party?
Note: Registered political party has the same meaning as in Part 4 of the Electoral Act 2002.
If yes, provide the name of the registered political party."	No	
Are you currently a Councillor?	No	
""		
"If yes, what has been your attendance record at Council meetings during your
current term of office?
Note: Council meetings means Council meetings referred to in section 61 of the Local Government Act 2020 but
does not include meetings held for which a Councillor has been granted leave from attending by the Council."		
"What are your contact details (so that voters can contact you)? Provide details
Email: aliforcasey2024@gmail.com Mobile: 0434 186 805"		
