COUNCIL	Casey City Council 2024
WARD (if applicable)	Grevillea Ward
CANDIDATE’S NAME (as on ballot paper)	POSTMA, Bernie
"What is your vision for the municipality of the above Council? (maximum 50 words)
My vision is to uplift the council in name and reputation. This council continues to grow at a
rapid rate and it is my hope the council matches this growth in the services and amendities it
provides."
"What expertise or attributes do you have which would help you in undertaking the role of Councillor?
Provide details (maximum 50 words)
As a Police officer I was involved in many legal matters, from the simple to complex matters. I
have served on Road Safety committees, Community Safety Committees, Neigbourhood
Watch and regularly engaged with local councils. I bring a wealth of knowledge, which would
help aid in decision making."
Have you read the current Council Plan for the council named above?	Yes	
Have you read the current Councillor Code of Conduct for the council named above?	Yes	
"Are you endorsed by a registered political party?
Note: Registered political party has the same meaning as in Part 4 of the Electoral Act 2002.
If yes, provide the name of the registered political party."	No	
Are you currently a Councillor?	No	
""		
"If yes, what has been your attendance record at Council meetings during your
current term of office?
Note: Council meetings means Council meetings referred to in section 61 of the Local Government Act 2020 but
does not include meetings held for which a Councillor has been granted leave from attending by the Council."		
"What are your contact details (so that voters can contact you)? Provide details
Email: burnard.p@optusnet.com.au"		
