COUNCIL	Casey City Council 2024
WARD (if applicable)	Waratah Ward
CANDIDATE’S NAME (as on ballot paper)	ALAM, Ezatullah
"What is your vision for the municipality of the above Council? (maximum 50 words)
I envision a City of Casey where every neighbourhood thrives with safety, vibrancy, and
inclusivity. By addressing governance issues, enhancing public services, and fostering
community engagement, we will build a connected, empowered community with a transparent
and accountable council where every resident's voice is valued and heard."
"What expertise or attributes do you have which would help you in undertaking the role of Councillor?
Provide details (maximum 50 words)
As a lawyer by profession and a long time public servant, I am very well aware of the issues
we are facing as a community. If elected, I would strongly advocate for lower crime rate,
integrity, transparency, and improved parks."
Have you read the current Council Plan for the council named above?	Yes	
Have you read the current Councillor Code of Conduct for the council named above?	Yes	
"Are you endorsed by a registered political party?
Note: Registered political party has the same meaning as in Part 4 of the Electoral Act 2002.
If yes, provide the name of the registered political party."	No	
Are you currently a Councillor?	No	
""		
"If yes, what has been your attendance record at Council meetings during your
current term of office?
Note: Council meetings means Council meetings referred to in section 61 of the Local Government Act 2020 but
does not include meetings held for which a Councillor has been granted leave from attending by the Council."		
"What are your contact details (so that voters can contact you)? Provide details
Mobile: 0466499493. Email: ezatullahalam@com.au"		
