COUNCIL	Casey City Council 2024
WARD (if applicable)	Dillwynia Ward
CANDIDATE’S NAME (as on ballot paper)	PANG, Joe
"What is your vision for the municipality of the above Council? (maximum 50 words)
My vision for the City of Casey is to create a connected community by advocating for
infrastructure, sustainable planning and fostering strong relationships among residents,
businesses, and local organisations. This aims drive growth and build a thriving, engaged
community."
"What expertise or attributes do you have which would help you in undertaking the role of Councillor?
Provide details (maximum 50 words)
My experience in local government will help me effectively undertake the role and bridge the
gap between the community and the council. My ability to plan and actively participate in
community engagement sessions has equipped me to listen to diverse perspectives and
translate those ideas into actionable steps."
Have you read the current Council Plan for the council named above?	Yes	
Have you read the current Councillor Code of Conduct for the council named above?	Yes	
"Are you endorsed by a registered political party?
Note: Registered political party has the same meaning as in Part 4 of the Electoral Act 2002.
If yes, provide the name of the registered political party."	No	
Are you currently a Councillor?	No	
""		
"If yes, what has been your attendance record at Council meetings during your
current term of office?
Note: Council meetings means Council meetings referred to in section 61 of the Local Government Act 2020 but
does not include meetings held for which a Councillor has been granted leave from attending by the Council."		
"What are your contact details (so that voters can contact you)? Provide details
weishengpang98@gmail.com"		
