COUNCIL	Casey City Council 2024
WARD (if applicable)	Quarters Ward
CANDIDATE’S NAME (as on ballot paper)	EAVES, Carolyn
"What is your vision for the municipality of the above Council? (maximum 50 words)
My vision for Casey is in line with council’s; to become a more connected, bold and resilient
community. I see this happening by supporting more community activities in Quarters, such
as establishing community allotments, morning tea groups and business networking groups.
These will assist us to build a stronger community."
"What expertise or attributes do you have which would help you in undertaking the role of Councillor?
Provide details (maximum 50 words)
I have many attributes to bring to the role of Councillor. I have lived here for 24 years and
raised my children here. I'm knowledgeable in good governance and have attained a MBA. I
have been a member and co-founder of several community groups. And I run a small
business."
Have you read the current Council Plan for the council named above?	Yes	
Have you read the current Councillor Code of Conduct for the council named above?	Yes	
"Are you endorsed by a registered political party?
Note: Registered political party has the same meaning as in Part 4 of the Electoral Act 2002.
If yes, provide the name of the registered political party."	No	
Are you currently a Councillor?	No	
""		
"If yes, what has been your attendance record at Council meetings during your
current term of office?
Note: Council meetings means Council meetings referred to in section 61 of the Local Government Act 2020 but
does not include meetings held for which a Councillor has been granted leave from attending by the Council."		
"What are your contact details (so that voters can contact you)? Provide details
Email: caseycouncil@ceaves.au , Web site: www.ceaves.au"		
