COUNCIL	Casey City Council 2024
WARD (if applicable)	Cranbourne Gardens Ward
CANDIDATE’S NAME (as on ballot paper)	MUIR, Jo
"What is your vision for the municipality of the above Council? (maximum 50 words)
To ensure that people from all backgrounds and walks of life feel heard and included. Our
community is at a crossroads. While we face challenges, we also have incredible
opportunities to create positive change. I believe that by coming together, we can make our
community stronger and more inclusive."
"What expertise or attributes do you have which would help you in undertaking the role of Councillor?
Provide details (maximum 50 words)
Creating positive change is a non negotiable, and it would continue in my role as councillor.
Working alongside local advocacy bodies and not for profit boards utilizes my growth mindset,
strong management and teamwork skills. I am an approachable and supportive member of
the community who cares."
Have you read the current Council Plan for the council named above?	Yes	
Have you read the current Councillor Code of Conduct for the council named above?	Yes	
"Are you endorsed by a registered political party?
Note: Registered political party has the same meaning as in Part 4 of the Electoral Act 2002.
If yes, provide the name of the registered political party."	No	
Are you currently a Councillor?	No	
""		
"If yes, what has been your attendance record at Council meetings during your
current term of office?
Note: Council meetings means Council meetings referred to in section 61 of the Local Government Act 2020 but
does not include meetings held for which a Councillor has been granted leave from attending by the Council."		
"What are your contact details (so that voters can contact you)? Provide details
Please email me at jomuir4casey@gmail.com. I will respond to all emails that I receive. I can
also be found on Facebook and Instagram. This gives you an insight into my movements in
the ward. I can receive messages and comments there also. I look forward to hearing from
you."		
